{
  "schemaVersion": 1,
  "manifestId": "WO-06D-PRODUCTION-CHANGE-MANIFEST-V1",
  "authorityBase": "56f18930b8a89b19cdbfdde24d090649329d50c9",
  "purpose": "PREDEPLOY_AUTHORIZATION_DEFINITION",
  "currentState": {
    "manifestDefinitionStatus": "FROZEN_DEFINITION",
    "deploymentAuthorizationRequest": "BLOCKED_PREREQUISITES",
    "deploymentGate": "BLOCKED_BY_PRODUCTION_DEPLOYMENT_GATE"
  },
  "target": {
    "provider": "TENCENT_CLOUD_CVM",
    "osFamily": "UBUNTU",
    "hostIdentityStatus": "UNRESOLVED_OUTSIDE_REPOSITORY",
    "hostIdentifier": null,
    "publicHostname": null,
    "applicationBind": "127.0.0.1:3800",
    "reverseProxyRoute": null,
    "containerName": null,
    "dataVolumeLogicalName": "shooting_data",
    "publicExposurePolicy": "HTTPS_REVERSE_PROXY_ONLY",
    "unresolvedFacts": [
      "TARGET_HOST_IDENTITY",
      "DISK_CAPACITY",
      "PORT_CONFLICT_CHECK",
      "CONTAINER_NAME",
      "REVERSE_PROXY_ROUTE",
      "TLS_CERTIFICATE_BINDING"
    ]
  },
  "secrets": [
    {
      "id": "VIEWER_TOKEN",
      "valuePresent": false,
      "generation": "DEPLOYMENT_TIME_RANDOM",
      "destination": "SERVER_RESTRICTED_CONFIG",
      "repositoryAllowed": false,
      "logsAllowed": false
    },
    {
      "id": "SUBMITTER_TOKEN",
      "valuePresent": false,
      "generation": "DEPLOYMENT_TIME_RANDOM",
      "destination": "SERVER_RESTRICTED_CONFIG",
      "repositoryAllowed": false,
      "logsAllowed": false
    },
    {
      "id": "SCHEDULER_TOKEN",
      "valuePresent": false,
      "generation": "DEPLOYMENT_TIME_RANDOM",
      "destination": "SERVER_RESTRICTED_CONFIG",
      "repositoryAllowed": false,
      "logsAllowed": false
    },
    {
      "id": "ADMIN_TOKEN",
      "valuePresent": false,
      "generation": "DEPLOYMENT_TIME_RANDOM",
      "destination": "SERVER_RESTRICTED_CONFIG",
      "repositoryAllowed": false,
      "logsAllowed": false
    }
  ],
  "gates": [
    {
      "id": "WO06A_LOCAL_BASELINE",
      "status": "SATISFIED",
      "evidence": "WO-06A_PREDEPLOY_EVIDENCE_BASELINE_PASS"
    },
    {
      "id": "WO06B_MIGRATION_RECOVERY",
      "status": "SATISFIED",
      "evidence": "WO-06B_MIGRATION_RECOVERY_ACCEPTANCE_PASS"
    },
    {
      "id": "WO06C_LOCAL_BOUNDARY",
      "status": "SATISFIED",
      "evidence": "WO-06C_LOCAL_EXTERNAL_BOUNDARY_PASS"
    },
    {
      "id": "WO06C_VCP_EXTERNAL",
      "status": "BLOCKED",
      "evidence": "BLOCKED_EXTERNAL_RUNTIME"
    },
    {
      "id": "VCP_DEPLOYABLE_ADAPTER_WIRING",
      "status": "BLOCKED",
      "evidence": "REAL_VCP_ADAPTER_RUNTIME_WIRING_NOT_IMPLEMENTED"
    },
    {
      "id": "WO06C_KIOSK_DEVICE",
      "status": "BLOCKED",
      "evidence": "BLOCKED_DEVICE"
    },
    {
      "id": "KIOSK_DEPLOYABLE_AUTH_WIRING",
      "status": "SATISFIED",
      "evidence": "PROD11_KIOSK_AUTH_RUNTIME_WIRING_R1_SOURCE_PASS"
    },
    {
      "id": "WO06C_DINGTALK_PROVIDER",
      "status": "READY_FOR_AUTHORIZATION",
      "evidence": "READY_FOR_EXTERNAL_INTEGRATION_AUTHORIZATION"
    },
    {
      "id": "DINGTALK_TARGET_BINDING",
      "status": "BLOCKED",
      "evidence": "EXACT_APP_PROVIDER_AND_TEST_DESTINATION_UNRESOLVED"
    },
    {
      "id": "DINGTALK_DEPLOYABLE_ADAPTER_WIRING",
      "status": "BLOCKED",
      "evidence": "REAL_DINGTALK_ADAPTER_CREDENTIALS_AND_RUNTIME_WIRING_NOT_IMPLEMENTED"
    },
    {
      "id": "CUTOVER_FORWARD_CHAIN",
      "status": "BLOCKED",
      "evidence": "REQUIRES_VERIFIED_PROD_02_03_04_05_06_07_09_10_11_AND_PROD_08_IF_USED"
    },
    {
      "id": "CUTOVER_SWITCH_RECOVERY",
      "status": "BLOCKED",
      "evidence": "POST_SWITCH_DUAL_READ_COMPATIBLE_WRITE_AND_SWITCH_RECORD_NOT_DESIGNED"
    },
    {
      "id": "CUTOVER_SOURCE_CONSISTENCY",
      "status": "BLOCKED",
      "evidence": "REQUIRES_DEPLOYABLE_SOURCE_WRITE_BARRIER_AND_EXACT_OFFLINE_OR_OPERATION_BOUND_FINAL_SYNC_PLAN_THROUGH_OLD_SOURCE_DEMOTION"
    },
    {
      "id": "CUTOVER_LIVE_SERVICE_READINESS",
      "status": "BLOCKED",
      "evidence": "REQUIRES_IMMEDIATE_LOOPBACK_HEALTH_AND_ROUTED_TLS_PROBE"
    },
    {
      "id": "TARGET_HOST_BINDING",
      "status": "BLOCKED",
      "evidence": "EXACT_CANDIDATE_PRODUCTION_HOST_UNRESOLVED"
    },
    {
      "id": "CONTAINER_START_READINESS",
      "status": "BLOCKED",
      "evidence": "REQUIRES_VERIFIED_PROD_02_03_04_09"
    },
    {
      "id": "PRE_CUTOVER_ORPHAN_CLEANUP_CONTROL",
      "status": "BLOCKED",
      "evidence": "REPOSITORY_ALL_ENTRY_POINT_DISABLE_DRAIN_IMPLEMENTED_DEPLOYMENT_ACCEPTANCE_PENDING"
    },
    {
      "id": "HEALTH_SMOKE_READINESS",
      "status": "BLOCKED",
      "evidence": "REQUIRES_VERIFIED_PROD_05"
    },
    {
      "id": "PROXY_BACKEND_READINESS",
      "status": "BLOCKED",
      "evidence": "REQUIRES_VERIFIED_PROD_04_05_06"
    },
    {
      "id": "PRE_CUTOVER_ROUTE_WRITE_RESTRICTION",
      "status": "BLOCKED",
      "evidence": "REQUIRES_PUBLIC_WRITE_BLOCK_OR_BOUNDED_STAGING_ACCESS"
    },
    {
      "id": "PRODUCTION_IMPORT_STORAGE_READINESS",
      "status": "BLOCKED",
      "evidence": "REQUIRES_VERIFIED_PROD_02"
    },
    {
      "id": "PRODUCTION_IMPORT_TARGET_ABSENCE",
      "status": "BLOCKED",
      "evidence": "REQUIRES_TARGET_SQLITE_PATH_ABSENT_BEFORE_PROD_05"
    },
    {
      "id": "PRODUCTION_IMPORT_SOURCE_CONSISTENCY",
      "status": "BLOCKED",
      "evidence": "REQUIRES_OFFLINE_SOURCE_QUIESCENCE_OR_VERIFIED_UPLOAD_MIGRATION_COORDINATION"
    },
    {
      "id": "PRODUCTION_ATTACHMENT_COPY_CAPABILITY",
      "status": "BLOCKED",
      "evidence": "REPOSITORY_ATTACHMENT_COPY_PARITY_ENGINE_IMPLEMENTED_LIVE_QUIESCENCE_PROVIDER_AND_TARGET_VOLUME_ACCEPTANCE_PENDING"
    },
    {
      "id": "INTEGRATION_DEPLOYMENT_READINESS",
      "status": "BLOCKED",
      "evidence": "REQUIRES_VERIFIED_PROD_02_03_04_05_06_07_09_AND_PROD_08_IF_USED"
    },
    {
      "id": "PRODUCTION_TARGET_FACTS",
      "status": "BLOCKED",
      "evidence": "UNRESOLVED_OUTSIDE_REPOSITORY"
    },
    {
      "id": "PRODUCTION_DATA_MIGRATION",
      "status": "BLOCKED",
      "evidence": "REAL_PRODUCTION_INPUT_NOT_VALIDATED"
    },
    {
      "id": "POST_CUTOVER_ORPHAN_CLEANUP_RESTORATION",
      "status": "BLOCKED",
      "evidence": "REQUIRES_VERIFIED_PROD_13_AND_POST_CUTOVER_ATTACHMENT_PARITY"
    },
    {
      "id": "CUTOVER_TARGET_WRITE_FENCE_CAPABILITY",
      "status": "BLOCKED",
      "evidence": "ALL_TARGET_DATABASE_ATTACHMENT_WRITERS_FENCE_DRAIN_AND_FAIL_CLOSED_RETENTION_NOT_IMPLEMENTED"
    },
    {
      "id": "RESTORED_CLEANUP_DISABLE_CAPABILITY",
      "status": "BLOCKED",
      "evidence": "REPOSITORY_DISABLE_DRAIN_IMPLEMENTED_BUT_EXACT_PROD_14_SCHEDULE_CANCELLATION_ROLLBACK_NOT_IMPLEMENTED"
    },
    {
      "id": "PRODUCTION_DEPLOYMENT_GATE",
      "status": "BLOCKED",
      "evidence": "BLOCKED_BY_PRODUCTION_DEPLOYMENT_GATE"
    }
  ],
  "actions": [
    {
      "id": "PROD-01-TARGET-READONLY-PREFLIGHT",
      "title": "Read-only target host preflight",
      "category": "TARGET",
      "risk": "LOW",
      "sideEffect": "READ_ONLY",
      "status": "BLOCKED_PREREQUISITE",
      "requiresExplicitAuthorization": true,
      "authorityTarget": "UNRESOLVED_PRODUCTION_HOST_IDENTITY",
      "preconditions": [
        "TARGET_HOST_BINDING"
      ],
      "effects": [
        "Verify the bound candidate host identity and resolve disk/port/container/proxy/TLS deployment facts without mutation"
      ],
      "rollbackActionIds": [],
      "evidenceRequired": [
        "BOUND_HOST_IDENTITY_MATCH",
        "DISK_CAPACITY",
        "PORT_CONFLICTS",
        "CONTAINER_CONFLICTS",
        "REVERSE_PROXY_ROUTE_CONFLICTS",
        "TLS_BINDING_FACTS"
      ]
    },
    {
      "id": "PROD-02-CREATE-ISOLATED-APP-STORAGE",
      "title": "Create isolated application directory and persistent volume",
      "category": "FILESYSTEM",
      "risk": "MEDIUM",
      "sideEffect": "IRREVERSIBLE_OR_EXTERNAL",
      "status": "BLOCKED_PREREQUISITE",
      "requiresExplicitAuthorization": true,
      "authorityTarget": "Resolved production host; new isolated application directory and data volume only",
      "preconditions": [
        "PRODUCTION_TARGET_FACTS",
        "PRODUCTION_DEPLOYMENT_GATE"
      ],
      "effects": [
        "Create new isolated application storage without modifying existing application data; retain the created directory and volume on rollback"
      ],
      "rollbackActionIds": [
        "ROLLBACK-04-PRESERVE-DATA-VOLUME"
      ],
      "evidenceRequired": [
        "TARGET_PATH",
        "VOLUME_NAME",
        "OWNER_MODE",
        "FREE_SPACE",
        "RETAINED_STORAGE_ARTIFACT_ACKNOWLEDGED"
      ]
    },
    {
      "id": "PROD-03-GENERATE-INSTALL-TOKENS",
      "title": "Generate and install four role tokens",
      "category": "SECRET",
      "risk": "HIGH",
      "sideEffect": "REVERSIBLE",
      "status": "BLOCKED_PREREQUISITE",
      "requiresExplicitAuthorization": true,
      "authorityTarget": "Resolved production host restricted runtime configuration for four role tokens",
      "preconditions": [
        "PRODUCTION_TARGET_FACTS",
        "PRODUCTION_DEPLOYMENT_GATE"
      ],
      "effects": [
        "Generate independent secret values and install them outside Git/logs/chat"
      ],
      "rollbackActionIds": [
        "ROLLBACK-06-REVOKE-ROLE-TOKENS"
      ],
      "evidenceRequired": [
        "SECRET_STORAGE_PATH",
        "FILE_OWNER_MODE",
        "NO_SECRET_OUTPUT_PROOF"
      ]
    },
    {
      "id": "PROD-04-BUILD-IMAGE",
      "title": "Build production image from approved authority source",
      "category": "BUILD",
      "risk": "MEDIUM",
      "sideEffect": "REVERSIBLE",
      "status": "BLOCKED_PREREQUISITE",
      "requiresExplicitAuthorization": true,
      "authorityTarget": "Resolved production host image store; exact approved authority commit only",
      "preconditions": [
        "PRODUCTION_TARGET_FACTS",
        "PRODUCTION_DEPLOYMENT_GATE"
      ],